{
  "$schema": "../../data/pack.schema.json",
  "format": 1,
  "id": "dargon",
  "name": "@pack.dargon.name",
  "description": "@pack.dargon.desc",
  "author": "zaig100",
  "version": "4.0",
  "game": "4.0.0",
  "icon": "icon.png",
  "start": "01",
  "levels": [
    "01",
    "02",
    "03",
    "04",
    "05",
    "06",
    "07",
    "08",
    "09",
    "10",
    "11",
    "12",
    "13",
    "14",
    "15",
    "16",
    "17",
    "18",
    "19",
    "20",
    "21",
    "22",
    "23",
    "24",
    "25",
    "26",
    "27",
    "shops/shop_05",
    "shops/shop_10",
    "shops/shop_15",
    "shops/shop_20",
    "shops/shop_25",
    "hub",
    "dev/test1",
    "dev/test2",
    "dev/test3",
    "dev/test4",
    "dev/test5"
  ],
  "modes": {
    "casual": { "start": [{ "id": "potion", "count": 4 }, { "id": "shield", "count": 3 }, { "id": "torch", "count": 2 }] },
    "normal": { "start": [{ "id": "potion", "count": 3 }, { "id": "shield", "count": 2 }, { "id": "torch" }] },
    "hardcore": { "start": [{ "id": "potion" }, { "id": "torch" }] }
  },
  "achievements": [
    { "id": "first_step", "name": "@ach.first_step.name", "description": "@ach.first_step.desc", "difficulty": "easy",
      "when": { "type": "level", "level": "01" } },
    { "id": "shopper", "name": "@ach.shopper.name", "description": "@ach.shopper.desc", "difficulty": "easy",
      "when": { "type": "count", "counter": "purchases", "atLeast": 1 } },
    { "id": "collector", "name": "@ach.collector.name", "description": "@ach.collector.desc", "difficulty": "easy",
      "when": { "type": "count", "counter": "coins", "atLeast": 100 } },
    { "id": "act1", "name": "@ach.act1.name", "description": "@ach.act1.desc", "difficulty": "easy",
      "when": { "type": "level", "level": "05" }, "reward": { "unlockStart": "06" } },
    { "id": "act2", "name": "@ach.act2.name", "description": "@ach.act2.desc", "difficulty": "medium",
      "when": { "type": "level", "level": "10" }, "reward": { "unlockStart": "11" } },
    { "id": "act3", "name": "@ach.act3.name", "description": "@ach.act3.desc", "difficulty": "medium",
      "when": { "type": "level", "level": "15" }, "reward": { "unlockStart": "16" } },
    { "id": "act4", "name": "@ach.act4.name", "description": "@ach.act4.desc", "difficulty": "medium",
      "when": { "type": "level", "level": "20" }, "reward": { "unlockStart": "21" } },
    { "id": "act5", "name": "@ach.act5.name", "description": "@ach.act5.desc", "difficulty": "hard",
      "when": { "type": "level", "level": "25" }, "reward": { "unlockStart": "26" } },
    { "id": "pocket_potion", "name": "@ach.pocket_potion.name", "description": "@ach.pocket_potion.desc", "difficulty": "medium",
      "when": { "type": "level", "since": "06", "level": "10", "without": ["potion"] },
      "reward": { "startItem": { "id": "potion" }, "modes": ["normal"] } },
    { "id": "keep_shield", "name": "@ach.keep_shield.name", "description": "@ach.keep_shield.desc", "difficulty": "medium",
      "when": { "type": "level", "since": "11", "level": "15", "without": ["shieldBreak"] },
      "reward": { "startItem": { "id": "shield" }, "modes": ["normal"] } },
    { "id": "through_dark", "name": "@ach.through_dark.name", "description": "@ach.through_dark.desc", "difficulty": "hard",
      "when": { "type": "level", "since": "01", "level": "09", "without": ["torch"] },
      "reward": { "startItem": { "id": "torch" }, "modes": ["normal"] } },
    { "id": "no_scratch", "name": "@ach.no_scratch.name", "description": "@ach.no_scratch.desc", "difficulty": "medium",
      "when": { "type": "level", "without": ["damage"] } },
    { "id": "spike_dancer", "name": "@ach.spike_dancer.name", "description": "@ach.spike_dancer.desc", "difficulty": "hard",
      "when": { "type": "level", "level": "17", "without": ["damage"] } },
    { "id": "sapper", "name": "@ach.sapper.name", "description": "@ach.sapper.desc", "difficulty": "hard",
      "when": { "type": "level", "level": "25", "without": ["damage", "trapSight"] } },
    { "id": "regular", "name": "@ach.regular.name", "description": "@ach.regular.desc", "difficulty": "medium",
      "when": { "type": "count", "counter": "purchases", "atLeast": 15 } },
    { "id": "finale", "name": "@ach.finale.name", "description": "@ach.finale.desc", "difficulty": "medium",
      "when": { "type": "game" } },
    { "id": "runner", "name": "@ach.runner.name", "description": "@ach.runner.desc", "difficulty": "hard",
      "when": { "type": "game", "maxTime": 1200 } },
    { "id": "miser", "name": "@ach.miser.name", "description": "@ach.miser.desc", "difficulty": "hard",
      "when": { "type": "game", "without": ["purchase"] } },
    { "id": "untouchable", "name": "@ach.untouchable.name", "description": "@ach.untouchable.desc", "difficulty": "hard",
      "when": { "type": "game", "modes": ["normal"], "maxDeaths": 0 } },
    { "id": "hardcore", "name": "@ach.hardcore.name", "description": "@ach.hardcore.desc", "difficulty": "hardcore",
      "when": { "type": "game", "modes": ["hardcore"] } },
    { "id": "iron", "name": "@ach.iron.name", "description": "@ach.iron.desc", "difficulty": "hardcore",
      "when": { "type": "game", "modes": ["hardcore"], "maxDeaths": 0 } },
    { "id": "ascetic", "name": "@ach.ascetic.name", "description": "@ach.ascetic.desc", "difficulty": "hardcore",
      "when": { "type": "game", "modes": ["hardcore"], "without": ["potion", "purchase"] } },
    { "id": "stubborn", "name": "@ach.stubborn.name", "description": "@ach.stubborn.desc", "difficulty": "easy", "hidden": true,
      "when": { "type": "count", "counter": "deaths", "atLeast": 100 } },
    { "id": "boom", "name": "@ach.boom.name", "description": "@ach.boom.desc", "difficulty": "easy", "hidden": true,
      "when": { "type": "death", "kind": "explosion" } },
    { "id": "pit", "name": "@ach.pit.name", "description": "@ach.pit.desc", "difficulty": "easy", "hidden": true,
      "when": { "type": "death", "kind": "fall" } },
    { "id": "pilgrim", "name": "@ach.pilgrim.name", "description": "@ach.pilgrim.desc", "difficulty": "medium", "hidden": true,
      "when": { "type": "count", "counter": "levels", "atLeast": 100 } }
  ]
}
